{
  "id": "champ-magnetique-courant",
  "title": {
    "fr": "Champ magnétique créé par un courant",
    "en": null,
    "ar": null
  },
  "tags": {
    "level": [
      "3eme-maths",
      "3eme-sciexp",
      "3eme-tech",
      "3eme-info"
    ],
    "field": [
      "electromagnetisme"
    ],
    "pattern": "parametric-visualization-target-match"
  },
  "sources": [
    {
      "book": "223332P00",
      "book_title": "Physique — 3ème année, Mathématiques",
      "chapter": "chapitre-2",
      "page": 46
    },
    {
      "book": "223333P00",
      "book_title": "Physique — 3ème année, Sciences expérimentales",
      "chapter": "chapitre-2",
      "page": 33
    },
    {
      "book": "223351P00",
      "book_title": "Physique — 3ème année, Sciences techniques",
      "chapter": "chapitre-4",
      "page": 53
    },
    {
      "book": "223371P00",
      "book_title": "Physique — 3ème année, Sciences de l'informatique",
      "chapter": "chapitre-5",
      "page": 65
    }
  ],
  "status": "ready",
  "format": "interactive",
  "formula": "Fil rectiligne infini: B = μ₀·I / (2π·r) ;  Solénoïde: B = μ₀·n·I",
  "pattern": "parametric-visualization-target-match",
  "sketch": "Observe: SVG canvas with a mode toggle: (a) straight wire, (b)\ncircular loop, (c) solenoid. Each mode exposes a current slider I\n(A) and a geometric slider (distance r for wire; radius R for loop;\nlength ℓ + turns N for solenoid). Canvas2D overlay renders field\nlines: concentric circles around straight wire; loops through center\nof coil; near-uniform axial field inside solenoid. Draggable test\npoint shows local B arrow and |B| readout using B = μ₀I/(2πr) or\nμ₀NI/ℓ. Right-hand rule visualized as a hand icon. Experiment:\ngiven target |B|, pick I and geometry. Evaluate: overlay hidden —\nstudent picks I and r/R/N so |B| at the marked point matches.\nWrinkle: μ₀ = 4π·10⁻⁷ baked in; currents in A, distances in cm."
}
