{
  "id": "champ-magnetique-aimant",
  "title": {
    "fr": "Champ magnétique créé par un aimant",
    "en": null,
    "ar": null
  },
  "tags": {
    "level": [
      "3eme-maths",
      "3eme-sciexp",
      "3eme-tech",
      "3eme-info"
    ],
    "field": [
      "electromagnetisme"
    ],
    "pattern": "parametric-visualization-target-match"
  },
  "sources": [
    {
      "book": "223332P00",
      "book_title": "Physique — 3ème année, Mathématiques",
      "chapter": "chapitre-2",
      "page": 41
    },
    {
      "book": "223333P00",
      "book_title": "Physique — 3ème année, Sciences expérimentales",
      "chapter": "chapitre-2",
      "page": 33
    },
    {
      "book": "223351P00",
      "book_title": "Physique — 3ème année, Sciences techniques",
      "chapter": "chapitre-4",
      "page": 47
    },
    {
      "book": "223371P00",
      "book_title": "Physique — 3ème année, Sciences de l'informatique",
      "chapter": "chapitre-4",
      "page": 50
    }
  ],
  "status": "ready",
  "format": "interactive",
  "formula": null,
  "pattern": "parametric-visualization-target-match",
  "sketch": "Observe: SVG canvas with a draggable, rotatable bar magnet (N/S\npoles color-coded). Canvas2D overlay renders magnetic field lines\n(pre-computed dipole streamlines) around the magnet. A draggable\ncompass needle test object shows local B direction. HUD: magnet\norientation angle, compass angle, distance from magnet center.\nExperiment: rotate and place the magnet so the compass at a fixed\ntarget point aligns to a target direction (e.g., east). Evaluate:\nfield lines hidden; student must orient the magnet from scratch so\na hidden compass needle at a marked point ends up pointing at a\ntarget direction. Wrinkle: field-line rendering uses a dipole\napproximation; no numeric B (this exercise is about direction)."
}
